{
  "skill": "arm64-purity",
  "schemaVersion": "1.0",
  "target": {
    "repo": "github.com/OpenCppCoverage/OpenCppCoverage",
    "commit": "3e518697ea761935574af486bacd5fcc1aeab363",
    "path": "OpenCppCoverage-0.9.9.0-windows-arm64.zip re-expanded from the published release asset"
  },
  "findings": [],
  "summary": {
    "blockers": 0,
    "high": 0,
    "medium": 0,
    "low": 0,
    "info": 0
  }
}
